row_id,interaction_id,run_interaction_id,span_selector,resolved_span_id,resolved_span_index,expected_project_id,expected_project_name_contains,expected_decision,actual_project_id,actual_project_name,actual_decision,actual_confidence,actual_prompt_version,actual_model_id,actual_reason_codes,actual_reasoning,char_start,char_end,has_expectation,is_correct,error,notes,tags
row_0001,cll_06E3K1VVKNT435XKDTRBNB8QD0,cll_06E3K1VVKNT435XKDTRBNB8QD0,span_index:0,800bb066-081a-4c5c-a5dc-2383aa043cf2,0,,,,310a3768-d7c0-4e72-88d0-aa67bf4d1b05,Winship Residence,assign,0.920,v1.12.0_world_model_facts,claude-3-haiku-20240307,,"The transcript contains only references to HCB staff names (Zack Sittler), which are not sufficient evidence to determine the project. The contact, Tony Araujo, is semi-anchored to two projects, but the transcript does not contain any explicit mentions of project names, addresses, or clients. Without stronger anchors from the transcript, I cannot confidently assign this conversation to a specific project. deterministic_homeowner_override_gate: forced assign to homeowner project 310a3768-d7c0-4e72-88d0-aa67bf4d1b05 (prev_decision=review, prev_project=null).",0,1054,false,true,,T1: zero-span common,tier0
row_0002,cll_06E3HS7S75RQK080ZN7K9Q84B0,cll_06E3HS7S75RQK080ZN7K9Q84B0,span_index:0,bcc995b2-5ac6-49e4-92ed-2e2ad908996f,0,,,assign,,,review,0.450,v1.12.0_world_model_facts,claude-3-haiku-20240307,"{weak_anchor,ambiguous_contact}","The transcript contains references to issues with a door and septic tank placement, but does not clearly mention any specific project. The contact, Randy Booth, is a 'floater' who works on multiple projects, so his identity does not provide a strong signal. There are no exact project names, addresses, or client names mentioned. The transcript includes some project-related details, but not enough to confidently attribute it to a single project.",0,1597,true,false,,T2: zero-span multi-span,tier0
row_0003,cll_06E3HG24Q9YM7BGK44NCQRV2Z8,cll_06E3HG24Q9YM7BGK44NCQRV2Z8,span_index:0,5cb4f00e-5dd9-4784-a7f8-0b5f2163ad01,0,,,assign,,,review,0.600,v1.12.0_world_model_facts,claude-3-haiku-20240307,{ambiguous_contact},"The transcript discusses siding materials and options, but does not contain any strong anchors like project name, address, client name, or other definitive identifiers. The contact, Flynt Treadaway, is a floater (works on 5+ projects) so his identity is not a reliable signal. There is no corroborating journal or email context. While the discussion of 'Japanese siding' and 'thermal' materials hints at a potential project, I do not have enough evidence to confidently assign this to a specific project.",0,1202,true,false,,T3: zero-span single,tier0
row_0004,cll_06E39KQRPDSAZ0B88TX3ZN87T8,cll_06E39KQRPDSAZ0B88TX3ZN87T8,span_index:0,999bca7b-7d67-4d0c-a08a-d4a5edc18a65,0,,winship,assign,310a3768-d7c0-4e72-88d0-aa67bf4d1b05,Winship Residence,assign,0.920,v1.12.0_world_model_facts,claude-3-haiku-20240307,,"The transcript contains multiple strong anchors to the Winship Residence project, including direct mentions of the client 'Lou Winship' and the alias 'Blanton' which is associated with this project. The contact, Lou Winship, is also an anchored contact who only works on this project, further strengthening the attribution. BizDev prospect gate held project assignment (text me; commitment_terms=none). deterministic_homeowner_override_gate: forced assign to homeowner project 310a3768-d7c0-4e72-88d0-aa67bf4d1b05 (prev_decision=review, prev_project=null).",0,1006,true,true,,T4: regression guard,tier0
row_0005,cll_06E37X99FHT1X1VB9SZNBR67MR,cll_06E37X99FHT1X1VB9SZNBR67MR,span_index:0,f78d974b-82a2-4af1-9eba-69c37e558b36,0,,,,310a3768-d7c0-4e72-88d0-aa67bf4d1b05,Winship Residence,review,0.750,v1.12.0_world_model_facts,claude-3-haiku-20240307,"{weak_anchor,ambiguous_contact}","The transcript contains multiple references to 'Lou Winship' and discussion of bricks, colors, and a deck, which strongly suggest this conversation is about the Winship Residence project.",0,1741,false,true,,T5: regression correct,tier0
