row_id,interaction_id,run_interaction_id,span_selector,resolved_span_id,resolved_span_index,expected_project_id,expected_project_name_contains,expected_decision,actual_project_id,actual_project_name,actual_decision,actual_confidence,actual_prompt_version,actual_model_id,actual_reason_codes,actual_reasoning,char_start,char_end,has_expectation,is_correct,error,notes,tags
gt_0004,cll_06E3K1VVKNT435XKDTRBNB8QD0,cll_06E3K1VVKNT435XKDTRBNB8QD0,span_index:0,b24610ea-96ce-467f-ba71-622a9e0b388c,0,,none,none,310a3768-d7c0-4e72-88d0-aa67bf4d1b05,Winship Residence,assign,0.920,v1.12.0_world_model_facts,claude-3-haiku-20240307,,"The transcript does not contain any explicit mentions of project names, addresses, or clients. The caller Tony Araujo is semi-anchored (works on 2 projects), but this is not enough to confidently assign this conversation to a specific project without further corroboration from the transcript. The transcript indicates some ongoing coordination between Tony and Zack Sittler (an HCB owner), but does not provide enough detail to determine the specific project they are discussing. deterministic_homeowner_override_gate: forced assign to homeowner project 310a3768-d7c0-4e72-88d0-aa67bf4d1b05 (prev_decision=review, prev_project=null).",0,1054,true,false,,,
gt_0005,cll_06E3HS7S75RQK080ZN7K9Q84B0,cll_06E3HS7S75RQK080ZN7K9Q84B0,span_index:0,5ef16d93-5678-46d5-a3da-e239f4c7c985,0,,winship,assign,,,review,0.500,v1.12.0_world_model_facts,claude-3-haiku-20240307,"{weak_anchor,ambiguous_contact}","The transcript does not contain any explicit mentions of project names, addresses, or client names. The contact, Randy Booth, is a 'floater' who works on many projects, so his identity is not a strong attribution signal. There are some references to project-related topics like a door issue and septic tank placement, but not enough information to definitively assign this call to a specific project. More context would be needed to make a confident decision.",0,1262,true,false,,,
gt_0006,cll_06E3HS7S75RQK080ZN7K9Q84B0,cll_06E3HS7S75RQK080ZN7K9Q84B0,span_index:1,f5b33339-aae5-471e-8629-468a735a7491,1,,permar,assign,d8091a15-6a69-4634-8d5b-117abea35aa6,Permar Residence,review,0.750,v1.12.0_world_model_facts,claude-3-haiku-20240307,"{weak_anchor,ambiguous_contact}","The transcript contains several strong anchors for the Permar Residence project, including mentions of 'brandon hightower' and 'hightower', which match project aliases. Additionally, the discussion around the placement of flags and utilities relative to the house distance aligns with open issues in the project journal.",1262,4195,true,false,,,
gt_0007,cll_06E3HG24Q9YM7BGK44NCQRV2Z8,cll_06E3HG24Q9YM7BGK44NCQRV2Z8,span_index:0,a9128b85-bd3b-49ed-8fe9-d4961b9833a7,0,,woodbery,assign,,,review,0.550,v1.12.0_world_model_facts,claude-3-haiku-20240307,"{weak_anchor,ambiguous_contact}","The transcript mentions Japanese siding that the client wants, which seems to be a specific material request. However, the contact Flynt Treadaway has a high fanout (5+ projects) and is treated like HCB staff, so his identity is not a strong attribution signal. Without a clear project name, address, or client name match in the transcript, I cannot confidently assign this to a specific project. I recommend a review to determine the appropriate project.",0,1234,true,false,,,
gt_0008,cll_06E3HG24Q9YM7BGK44NCQRV2Z8,cll_06E3HG24Q9YM7BGK44NCQRV2Z8,span_index:1,d54dd375-cef0-4da5-a6fe-53ea6b6993b5,1,,woodbery,assign,,,review,0.250,v1.12.0_world_model_facts,claude-3-haiku-20240307,"{quote_unverified,weak_anchor,ambiguous_contact}","The transcript does not contain any clear references to a specific project. The conversation seems to be about construction materials and methods, but does not mention any project names, addresses, clients, or other strong anchors. The contact, Flynt Treadaway, is a 'floater' with no clear project assignments, which reduces the signal from his identity. I don't have enough evidence to confidently assign this conversation to a particular project.",1234,1672,true,false,,,
gt_0009,cll_06E3HEWTR5RDD39AJK7PZ8G4X8,cll_06E3HEWTR5RDD39AJK7PZ8G4X8,span_index:0,013e05b0-e318-497b-9a39-873926c6f629,0,,winship,assign,,,review,0.650,v1.12.0_world_model_facts,claude-3-haiku-20240307,"{weak_anchor,ambiguous_contact}","The transcript discusses a door issue that needs to be addressed, but does not contain any strong anchors like an exact project name, address, or client name. The contact, Flynt Treadaway, is a floater who works on multiple projects, so his identity is not a strong signal. Some potentially relevant context is the discussion of caulking, bondo, and paint grade materials, which could match the Woodbery Residence project, but this is not conclusive. Without a clear anchor from the transcript, I recommend a review to determine the most likely project.",0,1359,true,false,,,
gt_0010,cll_06E3HEWTR5RDD39AJK7PZ8G4X8,cll_06E3HEWTR5RDD39AJK7PZ8G4X8,span_index:1,84590028-63f0-43e8-91c5-2e786b1fe8c8,1,,winship,assign,,,review,0.500,v1.12.0_world_model_facts,claude-3-haiku-20240307,"{weak_anchor,ambiguous_contact}","The transcript contains some references to a door and frame, but does not explicitly mention any project names, addresses, or clients. The contact, Flynt Treadaway, is a 'floater' who works on 5+ projects, so his identity does not provide a strong signal. Without a clear anchor from the transcript, I cannot confidently assign this conversation to a specific project.",1359,2718,true,false,,,
gt_0011,cll_06E3HCJ3KSY1K9B2RGECN5GNQM,cll_06E3HCJ3KSY1K9B2RGECN5GNQM,span_index:0,b7db42e8-e1ab-4b30-847d-f5b29776df1e,0,,winship,assign,,,review,0.600,v1.12.0_world_model_facts,claude-3-haiku-20240307,"{quote_unverified,weak_anchor,ambiguous_contact}","The transcript discusses an issue with a door frame that was damaged during removal of boards used for moving purposes. While the caller, Jimmy Chastain, has worked on several HCB projects, there is no clear anchor in the transcript to a specific project. The journal and world model context do not provide enough corroborating evidence to confidently assign this conversation to a particular project.",0,1741,true,false,,,
gt_0012,cll_06E3HCJ3KSY1K9B2RGECN5GNQM,cll_06E3HCJ3KSY1K9B2RGECN5GNQM,span_index:1,862af6ec-545b-493f-b2cc-d24f9e76fe9d,1,,winship,assign,a3244d97-7301-4e63-a2c6-2ca01d7041a4,Woodbery Barns,review,0.650,v1.12.0_world_model_facts,claude-3-haiku-20240307,"{weak_anchor,ambiguous_contact}","The transcript mentions issues with a door and hinges, as well as Carter Lumber, a material supplier. This suggests the Woodbery Barns project, which Jimmy Chastain is associated with as a 'drifter' contact. However, the conversation does not contain any explicit project name, address, or client references to definitively assign it to that project. More corroborating evidence would be needed to confidently attribute this call.",1741,3483,true,false,,,
gt_0013,cll_06E3A9094NX6N25F8TQXEPH3YG,cll_06E3A9094NX6N25F8TQXEPH3YG,span_index:0,b00f6183-e68b-4991-8a19-41d9f9813e15,0,,Winship,assign,310a3768-d7c0-4e72-88d0-aa67bf4d1b05,Winship Residence,review,0.850,v1.12.0_world_model_facts,claude-3-haiku-20240307,"{quote_unverified,weak_anchor}","The contact, Ron, is an anchored contact who only works on the Winship Residence project. Zack Sittler mentions discussing 'that material' and 'the door itself' in the context of Ron's work, which strongly suggests this conversation is about the Winship Residence project.",0,773,true,false,,,
gt_0014,cll_06E3A9094NX6N25F8TQXEPH3YG,cll_06E3A9094NX6N25F8TQXEPH3YG,span_index:1,9b89cc82-2d44-4897-b1a4-0b2c9be0053b,1,,winship,assign,310a3768-d7c0-4e72-88d0-aa67bf4d1b05,Winship Residence,review,0.850,v1.12.0_world_model_facts,claude-3-haiku-20240307,{weak_anchor},"The transcript contains strong evidence that this conversation is about the Winship Residence project. The caller, Ron, has a fanout of 1, indicating he works exclusively on the Winship Residence. The discussion about milling and shaping doors for a 'shaker style' project matches the active work happening on the Winship Residence based on the contact's project history.",773,1365,true,false,,,
gt_0015,cll_06E3A4QAMNTRZA5CPVV335PZA8,cll_06E3A4QAMNTRZA5CPVV335PZA8,span_index:0,82ee85ce-9f01-4bf5-8298-616ed12d0c05,0,,winship,assign,310a3768-d7c0-4e72-88d0-aa67bf4d1b05,Winship Residence,review,0.700,v1.12.0_world_model_facts,claude-3-haiku-20240307,{weak_anchor},"The transcript mentions 'lou' and 'Ginger Gray', which are associated with the Winship Residence project. However, there is no explicit mention of the project name, address, or client to definitively confirm the project. The conversation also includes references to 'chad' and 'paper', which could be related to other projects. Additional review is needed to confirm the primary topic of the conversation.",0,781,true,false,,,
gt_0016,cll_06E3A4QAMNTRZA5CPVV335PZA8,cll_06E3A4QAMNTRZA5CPVV335PZA8,span_index:1,12844ae6-2249-4ff5-b4f2-c7c4cbcd461a,1,,winship,assign,,,review,0.900,v1.12.0_world_model_facts,claude-3-haiku-20240307,"{weak_anchor,bizdev_without_commitment}","The transcript contains multiple references to the 'Winship Residence' project, including mentions of 'lou', 'alex', 'zach givens', and 'Ginger Gray' who is known to work on this project. The discussion around pavers, irrigation, and landscaping details are all consistent with ongoing work on the Winship Residence. BizDev prospect gate held project assignment (looking at; commitment_terms=none).",781,5459,true,false,,,
gt_0017,cll_06E3A1T135WSF0XV3J64CJFZ3G,cll_06E3A1T135WSF0XV3J64CJFZ3G,span_index:0,55c38f75-0e52-48e7-b20a-8277f15e4b48,0,,winship,assign,310a3768-d7c0-4e72-88d0-aa67bf4d1b05,Winship Residence,review,0.850,v1.12.0_world_model_facts,claude-3-haiku-20240307,{weak_anchor},"The transcript includes strong evidence that this conversation is about the Winship Residence project. The caller, Ginger Gray, is identified as a contact associated with the Winship Residence project. Additionally, the mention of 'lou' and discussion of pavers suggests this is related to ongoing work on the Winship Residence.",0,898,true,false,,,
gt_0020,cll_06E39P8TGHVQD0P1NEFDFZ5X9W,cll_06E39P8TGHVQD0P1NEFDFZ5X9W,span_index:0,101ef30a-e7a9-4fb9-9161-f68c1c82906c,0,,winship,assign,,,,,,,,,0,395,true,false,,,
gt_0021,cll_06E39P95SHVQDEZ5KH1GZV2X04,cll_06E39P95SHVQDEZ5KH1GZV2X04,span_index:0,717699b7-9827-41e7-b715-6f7184184cef,0,,none,none,310a3768-d7c0-4e72-88d0-aa67bf4d1b05,Winship Residence,assign,0.920,v1.12.0_world_model_facts,claude-3-haiku-20240307,,"The transcript does not contain any explicit references to project names, addresses, client names, or other strong anchor points. The contact, Zach Givens, is a 'drifter' with a weak signal, working across multiple projects. Without a clear transcript-grounded anchor, I cannot confidently assign this conversation to a specific project, but the Winship Residence appears to be the most likely candidate based on the contact's project history. deterministic_homeowner_override_gate: forced assign to homeowner project 310a3768-d7c0-4e72-88d0-aa67bf4d1b05 (prev_decision=review, prev_project=null).",0,361,true,false,,,
gt_0022,cll_06E37X99FHT1X1VB9SZNBR67MR,cll_06E37X99FHT1X1VB9SZNBR67MR,span_index:0,6401a57b-a880-4e62-9849-63610920efdb,0,,winship,assign,310a3768-d7c0-4e72-88d0-aa67bf4d1b05,Winship Residence,review,0.800,v1.12.0_world_model_facts,claude-3-haiku-20240307,"{weak_anchor,ambiguous_contact}","The transcript contains multiple strong anchors indicating the Winship Residence project, including the explicit mention of 'Lou Winship'. The contact, Lou Winship, is an anchored contact who works only on this project. There is also context about sending pictures and choosing materials, which aligns with active work on the Winship Residence.",0,2165,true,false,,,
gt_0023,cll_06E37X99FHT1X1VB9SZNBR67MR,cll_06E37X99FHT1X1VB9SZNBR67MR,span_index:1,c87060c4-29a4-426f-a6f3-eab84d1937df,1,,winship,assign,310a3768-d7c0-4e72-88d0-aa67bf4d1b05,Winship Residence,review,0.750,v1.12.0_world_model_facts,claude-3-haiku-20240307,"{weak_anchor,ambiguous_contact}","The transcript contains a direct mention of 'Lou Winship', which matches the client name of the Winship Residence project. Additionally, the context of discussing available brick and coordinating with Chad aligns with the active project status of the Winship Residence.",2165,2709,true,false,,,
gt_0024,cll_06E379H5W9WY581M5W62M05TRG,cll_06E379H5W9WY581M5W62M05TRG,span_index:0,ce85297e-3f34-4188-a509-e71e242d012a,0,,woodbery,assign,310a3768-d7c0-4e72-88d0-aa67bf4d1b05,Winship Residence,review,0.740,v1.12.0_world_model_facts,claude-3-haiku-20240307,{ambiguous_contact},"The transcript contains multiple mentions of 'windships', which appears to be a reference to the Winship Residence project. However, the caller Zack Sittler is a floater contact with evidence across many projects, so his identity alone is not a strong attribution signal. The transcript does not contain any other strong anchors like an exact project name, address, or client name. Additionally, the Winship Residence project does not have any relevant journal context that would corroborate the conversation topic. Therefore, I do not have enough definitive evidence to confidently assign this call to the Winship Residence project, so I am recommending a review.",0,400,true,false,,,
gt_0028,cll_06E368SS4XTAS9PH4YF6YKEJYR,cll_06E368SS4XTAS9PH4YF6YKEJYR,span_index:0,e68fd81a-3b37-4958-ab9b-4cfdc47b592e,0,,winship,assign,,,review,0.300,v1.12.0_world_model_facts,claude-3-haiku-20240307,"{ambiguous_contact,bizdev_without_commitment}","The transcript contains some references to a 'Blanton' and 'Randy', but no clear mention of a specific project name, address, or client. The contact, Zack Sittler, is a floater with contacts across multiple projects, so his identity alone does not provide a strong attribution signal. There is also no clear matching journal context or world model facts to corroborate a particular project. Based on the available information, I don't have enough evidence to confidently assign this conversation to a specific project, so a 'review' decision is appropriate. BizDev prospect gate held project assignment (proposal; commitment_terms=none).",0,1504,true,false,,,
gt_0029,cll_06E368SS4XTAS9PH4YF6YKEJYR,cll_06E368SS4XTAS9PH4YF6YKEJYR,span_index:1,496d4ffb-b591-4c00-a3fc-bc5cce7cbf86,1,,winship,assign,,,review,0.570,v1.12.0_world_model_facts,claude-3-haiku-20240307,"{weak_anchor,ambiguous_contact,geo_only,bizdev_without_commitment}","The transcript mentions several project-related details, including garden boxes, irrigation, and a plan that was left with 'Randy'. This suggests the Woodbery Barns project as the most likely candidate. However, the transcript also mentions 'downtown Madison', which could indicate the Woodbery Residence project instead. Without a stronger anchor from the transcript, I cannot confidently assign this conversation to a specific project. BizDev prospect gate held project assignment (looking at; commitment_terms=none).",1504,5272,true,false,,,
gt_0030,cll_06E3YJFNA1XTX4PR9KJVTTHWSM,cll_06E3YJFNA1XTX4PR9KJVTTHWSM,span_index:0,57a1a02c-e469-4114-97f7-4cfd66f06023,0,,winship,assign,,,review,0.750,v1.12.0_world_model_facts,claude-3-haiku-20240307,"{weak_anchor,ambiguous_contact,bizdev_without_commitment}","The transcript contains several references to material and door specifications that strongly suggest the Woodbery Residence project. The contact, Zack Sittler, is a known HCB staff member, but the content of the conversation indicates he is discussing details with a subcontractor, which is consistent with the Woodbery Residence project. BizDev prospect gate held project assignment (looking at; commitment_terms=none).",0,2393,true,false,,,
gt_0031,cll_06E3YJFNA1XTX4PR9KJVTTHWSM,cll_06E3YJFNA1XTX4PR9KJVTTHWSM,span_index:1,03d57521-cde8-40e6-94af-02ada9e7f6c8,1,,winship,assign,310a3768-d7c0-4e72-88d0-aa67bf4d1b05,Winship Residence,review,0.780,v1.12.0_world_model_facts,claude-3-haiku-20240307,"{weak_anchor,ambiguous_contact}","The transcript contains several references to Madison, GA, which matches the location of the Winship Residence project. Additionally, the discussion around the wood material, drying process, and plans for the doors aligns with the details of this ongoing construction project.",2393,9605,true,false,,,
gt_0032,cll_06E3YJFNA1XTX4PR9KJVTTHWSM,cll_06E3YJFNA1XTX4PR9KJVTTHWSM,span_index:2,,,,winship,assign,,,,,,,,,,,true,false,span_not_found,,
gt_0033,cll_06E3YJFNA1XTX4PR9KJVTTHWSM,cll_06E3YJFNA1XTX4PR9KJVTTHWSM,span_index:3,,,,winship,assign,,,,,,,,,,,true,false,span_not_found,,
gt_0034,cll_06E3YJFNA1XTX4PR9KJVTTHWSM,cll_06E3YJFNA1XTX4PR9KJVTTHWSM,span_index:4,,,,winship,assign,,,,,,,,,,,true,false,span_not_found,,
gt_0035,cll_06E45FDGQNSDD7RKBTJRTS0RAC,cll_06E45FDGQNSDD7RKBTJRTS0RAC,span_index:0,d10ba1bb-d996-4ada-85bb-7c9663317496,0,,permar,assign,,,none,0.000,v1.12.0_world_model_facts,claude-3-haiku-20240307,"{weak_anchor,ambiguous_contact}",blocked_project: Sittler Madison: treat attributions as incorrect until further notice. Original decision overridden by blocklist.,0,1625,true,false,,,
gt_0037,cll_06E45YJE9XWEK0SE3DPP6X23HM,cll_06E45YJE9XWEK0SE3DPP6X23HM,span_index:0,cf9776fc-d9d6-45cf-9179-27c619d3b325,0,,winship,assign,,,review,0.500,v1.12.0_world_model_facts,claude-3-haiku-20240307,"{weak_anchor,ambiguous_contact}","The transcript mentions a 'walkway' that Zack Sittler is working on, but does not provide enough details to definitively match to a specific project. The contact, John Singleton, is a 'drifter' who works on multiple projects, so his identity alone is not a strong attribution signal. Without an exact project name, address, or client mentioned in the transcript, I cannot confidently assign this conversation to a specific project.",0,630,true,false,,,
gt_0042,cll_06E46MKR29Y9X81BK52JJAM9TG,cll_06E46MKR29Y9X81BK52JJAM9TG,span_index:0,9af4e3bf-944c-4474-853a-c6493b86d414,0,,woodbery,assign,310a3768-d7c0-4e72-88d0-aa67bf4d1b05,Winship Residence,assign,0.800,v1.12.0_world_model_facts,claude-3-haiku-20240307,,"The transcript contains multiple references to the 'Bethany' project, including an explicit mention of 'Bethany Rd' and the fact that the team is 'landscaping and getting prepped on hardscape on bethany'. This, combined with the context that Zack Sittler is a floater contact (works on multiple projects), leads me to conclude that the primary topic of this conversation is the Winship Residence project.",0,1137,true,false,,,
gt_0043,cll_06E46MKR29Y9X81BK52JJAM9TG,cll_06E46MKR29Y9X81BK52JJAM9TG,span_index:1,8f03495c-7506-4b68-8680-02c6c3f08e65,1,,woodbery,assign,,,review,0.250,v1.12.0_world_model_facts,claude-3-haiku-20240307,"{weak_anchor,ambiguous_contact}","The transcript contains references to timber, emails, and landscaping work, but does not explicitly mention any project names, addresses, clients, or other strong anchors. The contact, Zack Sittler, is a floater with assignments across multiple projects, so his identity is not a reliable attribution signal. Without a clear project-related anchor from the transcript, I do not have enough evidence to confidently assign this conversation to a specific project.",1137,2274,true,false,,,
gt_0045,cll_06E46PAHC1W3B75EWZ48DN6KHC,cll_06E46PAHC1W3B75EWZ48DN6KHC,span_index:1,f9f7f729-fd84-44ea-acb6-303817f49324,1,,winship,assign,7db5e186-7dda-4c2c-b85e-7235b67e06d8,Woodbery Residence,review,0.750,v1.12.0_world_model_facts,claude-3-haiku-20240307,"{weak_anchor,ambiguous_contact}","The transcript contains multiple references to grout color and pavers, which indicates a discussion about material selections for an active construction project. While the contact John Singleton is a 'drifter' with multiple project associations, the references to 'the homeowner' and 'the one that you and i showed' suggest this is specifically about the Woodbery Residence project that John Singleton is associated with.",1228,2457,true,false,,,
gt_0046,cll_06E46Y0H01Z2KFZKMH7VSB16FM,cll_06E46Y0H01Z2KFZKMH7VSB16FM,span_index:0,a0f3d46f-dc51-4264-a00b-cfbb4e1373c6,0,,winship,assign,,,review,0.650,v1.12.0_world_model_facts,claude-3-haiku-20240307,"{weak_anchor,ambiguous_contact}","The transcript discusses a conversation about mortar and brick selection for a construction project, but does not contain any explicit mentions of project names, addresses, clients, or other strong anchors. The contacts involved, Zack Sittler and John Singleton, are both floater contacts with 5+ project affiliations, so their identities do not provide a strong attribution signal. There are no clear journal context matches or world model facts that would corroborate a specific project. Based on the limited evidence, I believe this conversation is likely about an active construction project, but cannot confidently assign it to a specific project in the candidate set.",0,1525,true,false,,,
gt_0047,cll_06E46Y0H01Z2KFZKMH7VSB16FM,cll_06E46Y0H01Z2KFZKMH7VSB16FM,span_index:1,a1a480cb-e088-4473-beae-75796f3da21a,1,,winship,assign,,,review,0.500,v1.12.0_world_model_facts,claude-3-haiku-20240307,"{weak_anchor,ambiguous_contact}","The transcript contains discussions about a color choice for a project, with Zack Sittler and John Singleton making decisions. However, there are no explicit mentions of project names, addresses, clients, or other strong anchors to definitively match this conversation to a specific project. The contact Zack Sittler is a floater who works on multiple projects, so his identity alone is not a strong signal. I recommend reviewing this further to determine the most likely project.",1525,3620,true,false,,,
gt_0049,cll_06E471A9CNR6X6X14E6P6BY15W,cll_06E471A9CNR6X6X14E6P6BY15W,span_index:1,29261b18-e162-40ab-88d0-c511e4b9293b,1,,skelton,assign,,,review,0.750,v1.12.0_world_model_facts,claude-3-haiku-20240307,"{weak_anchor,ambiguous_contact,bizdev_without_commitment}","The transcript contains multiple explicit references to a tub/bathtub that does not fit the space, as well as discussion about the client choosing between an oval or rectangular tub. This matches the Skelton Residence project, where the client is trying to find the right tub to fit the space. Additionally, Zack Sittler, who is a floater contact with no single project attribution, is heavily involved in the conversation, which is consistent with his role as the owner overseeing multiple projects. BizDev prospect gate held project assignment (quote; commitment_terms=none).",1260,4909,true,false,,,
gt_0050,cll_06E47E38KNSG5909WX2JDDENHC,cll_06E47E38KNSG5909WX2JDDENHC,span_index:0,09db34bb-2ecd-4b30-95c1-50287cc02601,0,,woodbery,assign,,,review,0.400,v1.12.0_world_model_facts,claude-3-haiku-20240307,"{weak_anchor,ambiguous_contact}","The transcript does not contain any explicit mentions of project names, addresses, client names, or other strong anchors. The conversation appears to be about a general construction or design issue, possibly related to a porch or terrace area, but there is no clear indication of the specific project being discussed. The contact, Zack Sittler, is a floater who works on multiple projects, so his identity is not a strong signal. Some context from project journals or the world model could help narrow down the project, but the transcript alone is not sufficient for a confident assignment.",0,1709,true,false,,,
gt_0051,cll_06E47E38KNSG5909WX2JDDENHC,cll_06E47E38KNSG5909WX2JDDENHC,span_index:1,433bfd09-3437-4099-829f-68c556ca09ed,1,,woodbery,assign,,,review,0.250,v1.12.0_world_model_facts,claude-3-haiku-20240307,"{weak_anchor,ambiguous_contact}","The transcript contains some discussion of construction materials and details, but does not explicitly mention any project names, addresses, or client names. The contact, Zack Sittler, is an HCB staff member and not a client, so his name cannot be used as evidence. There are no strong anchors in the transcript to confidently attribute this conversation to a specific project.",1709,2155,true,false,,,
gt_0052,cll_06E47E38KNSG5909WX2JDDENHC,cll_06E47E38KNSG5909WX2JDDENHC,span_index:2,67c53e1e-d216-4fe1-9c93-0bbaaf2eba34,2,,woodbery,assign,d8091a15-6a69-4634-8d5b-117abea35aa6,Permar Residence,assign,0.850,v1.12.0_world_model_facts,claude-3-haiku-20240307,,"The transcript contains multiple explicit references to the 'Sparta' location, which matches the Permar Residence project in Sparta, Georgia. Additionally, the discussion around material costs and cedar vs. cypress aligns with the details of this project.",2155,9283,true,false,,,
gt_0056,cll_06E47PRHV5R67DMHG19G8ZNYM8,cll_06E47PRHV5R67DMHG19G8ZNYM8,span_index:0,fd27f7c2-d1fe-45e8-86b7-db1b88906a8d,0,,woodbery,assign,,,review,0.850,v1.12.0_world_model_facts,claude-3-haiku-20240307,"{ambiguous_contact,bizdev_without_commitment}","The transcript contains multiple references to 'Woodbery' and 'Shayelyn Woodbery', which are strong anchors linking this conversation to the Woodbery Residence project. The discussion around exposed rafters and a solid ceiling also matches an open loop from the project journal, further strengthening the attribution. BizDev prospect gate held project assignment (looking at; commitment_terms=none).",0,1159,true,false,,,
